{
  "schema_version": "1.0.0",
  "event_id": "00000000-0000-4000-8000-000000000004",
  "patient_id": "pt_adc8a04498d64597b7bc858f",
  "modality": "video",
  "event_type": "postura_fora_da_faixa",
  "timestamp": "2026-09-26T15:20:08.400Z",
  "detected_at": "2026-09-26T15:31:02.004Z",
  "ingested_at": "2026-09-26T15:25:00.000Z",
  "window": {
    "start": "2026-09-26T15:20:08.400Z",
    "end": "2026-09-26T15:20:10.100Z"
  },
  "score": 0.66,
  "severity": "media",
  "evidence": {
    "summary": "Flexão de joelho direito de 148° por 1,7 s, acima da faixa esperada de 0–135°",
    "features": {
      "articulacao": "joelho_direito",
      "angulo_max_graus": 148.0,
      "duracao_s": 1.7,
      "confianca_keypoints_media": 0.81
    },
    "thresholds": {
      "faixa_max_graus": 135,
      "janela_min_s": 1.0,
      "confianca_min_keypoint": 0.3
    },
    "models": {
      "openpose": "BODY_25",
      "yolov8": "yolov8n-8.3.40"
    },
    "artifacts": [
      {
        "kind": "frame",
        "uri": "saida/video/fisio-003/frame-0488400.jpg",
        "media_type": "image/jpeg",
        "start_ms": 488400,
        "end_ms": 488400
      }
    ]
  },
  "model_version": "video-desvios@0.1.0",
  "context": {
    "encounter_id": "enc_56cf0a4b5a51d6a7c4817557",
    "bed_id": "UTI-07",
    "source_id": "fisio-003",
    "procedure_type": "fisioterapia"
  },
  "related_event_ids": [],
  "is_synthetic": false
}
