{
  "schema_version": "1.0.0",
  "event_id": "00000000-0000-4000-8000-000000000007",
  "patient_id": "pt_adc8a04498d64597b7bc858f",
  "modality": "movimentacao",
  "event_type": "imobilidade_prolongada",
  "timestamp": "2026-09-26T16:55:00.000Z",
  "detected_at": "2026-09-26T16:55:04.900Z",
  "window": {
    "start": "2026-09-26T14:15:00.000Z",
    "end": "2026-09-26T16:55:00.000Z"
  },
  "score": 0.55,
  "severity": "media",
  "evidence": {
    "summary": "2 h 40 min sem mudança de posição no leito",
    "features": {
      "minutos_sem_mudanca": 160,
      "reposicionamentos_ultimas_6h": 1
    },
    "thresholds": {
      "minutos_max_sem_mudanca": 120
    },
    "models": {},
    "artifacts": []
  },
  "model_version": "anomalias-movimentacao@0.1.0",
  "context": {
    "encounter_id": "enc_56cf0a4b5a51d6a7c4817557",
    "bed_id": "UTI-07",
    "source_id": "cam-uti-07"
  },
  "related_event_ids": [],
  "is_synthetic": false
}
