{
  "schema_version": "1.0.0",
  "event_id": "00000000-0000-4000-8000-000000000001",
  "patient_id": "pt_adc8a04498d64597b7bc858f",
  "modality": "sinais_vitais",
  "event_type": "news2_resposta_urgente",
  "timestamp": "2026-09-26T17:02:00.000Z",
  "detected_at": "2026-09-26T17:02:03.412Z",
  "ingested_at": "2026-09-26T17:02:01.050Z",
  "window": {
    "start": "2026-09-26T16:57:00.000Z",
    "end": "2026-09-26T17:02:00.000Z"
  },
  "score": 0.71,
  "severity": "media",
  "evidence": {
    "summary": "NEWS2 = 6 (SpO2 92%, FR 23 irpm, FC 112 bpm): resposta urgente",
    "features": {
      "news2_total": 6,
      "spo2_pct": 92,
      "fr_irpm": 23,
      "fc_bpm": 112,
      "pas_mmhg": 118,
      "news2_spo2": 2,
      "news2_fr": 2,
      "news2_fc": 2
    },
    "thresholds": {
      "news2_urgente_total": 5,
      "news2_emergencia_total": 7,
      "news2_parametro_unico": 3
    },
    "models": {
      "news2": "RCP-2017"
    },
    "artifacts": [
      {
        "kind": "serie_temporal",
        "uri": "saida/sinais/pt_adc8a04498d64597b7bc858f/2026-09-26T17-02.json",
        "media_type": "application/json"
      }
    ]
  },
  "model_version": "anomalias-sinais@0.1.0",
  "context": {
    "encounter_id": "enc_56cf0a4b5a51d6a7c4817557",
    "bed_id": "UTI-07"
  },
  "related_event_ids": [],
  "is_synthetic": false
}
