{
  "schema_version": "1.0.0",
  "event_id": "00000000-0000-4000-8000-000000000005",
  "patient_id": "pt_adc8a04498d64597b7bc858f",
  "modality": "video",
  "event_type": "sem_achados",
  "timestamp": "2026-09-26T10:00:00.000Z",
  "detected_at": "2026-09-26T10:14:31.500Z",
  "window": {
    "start": "2026-09-26T10:00:00.000Z",
    "end": "2026-09-26T10:12:45.000Z"
  },
  "score": 0.0,
  "severity": "info",
  "evidence": {
    "summary": "Sessão de fisioterapia sem desvios detectados",
    "features": {
      "duracao_s": 765,
      "frames_processados": 3825,
      "fps_processado": 5
    },
    "thresholds": {},
    "models": {
      "openpose": "BODY_25",
      "yolov8": "yolov8n-8.3.40"
    },
    "artifacts": []
  },
  "model_version": "video-desvios@0.1.0",
  "context": {
    "encounter_id": "enc_56cf0a4b5a51d6a7c4817557",
    "bed_id": "UTI-07",
    "source_id": "fisio-002",
    "procedure_type": "fisioterapia"
  },
  "related_event_ids": [],
  "is_synthetic": false
}
