{
  "schema_version": "1.0.0",
  "event_id": "00000000-0000-4000-8000-000000000008",
  "patient_id": "pt_adc8a04498d64597b7bc858f",
  "modality": "fusao",
  "event_type": "risco_multimodal",
  "timestamp": "2026-09-26T17:05:20.000Z",
  "detected_at": "2026-09-26T17:06:53.210Z",
  "ingested_at": "2026-09-26T17:02:01.050Z",
  "window": {
    "start": "2026-09-26T16:35:20.000Z",
    "end": "2026-09-26T17:05:20.000Z"
  },
  "score": 0.86,
  "severity": "alta",
  "evidence": {
    "summary": "Risco alto: SpO2 em queda (NEWS2 6) combinada a fala com dispneia e relato de falta de ar",
    "features": {
      "contrib_sinais_vitais": 0.34,
      "contrib_audio": 0.27,
      "contrib_texto": 0.19,
      "contrib_prescricoes": 0.06,
      "contrib_video": 0.0,
      "modalidades_presentes": 4,
      "score_max_isolado": 0.78
    },
    "thresholds": {
      "janela_min": 30,
      "risco_alto": 0.7,
      "risco_medio": 0.4
    },
    "models": {},
    "artifacts": []
  },
  "model_version": "fusao-late-rules@0.1.0",
  "context": {
    "encounter_id": "enc_56cf0a4b5a51d6a7c4817557",
    "bed_id": "UTI-07"
  },
  "related_event_ids": [
    "00000000-0000-4000-8000-000000000001",
    "00000000-0000-4000-8000-000000000002",
    "00000000-0000-4000-8000-000000000003",
    "00000000-0000-4000-8000-000000000006"
  ],
  "is_synthetic": false
}
